id,title,description,required_skills,preferred_skills,category,location,state,organization,education_requirement
390,Robotics Intern (Embedded),"Program and test embedded systems for robotic applications","['C', 'Microcontrollers']","['ROS', 'Embedded Linux']",Engineering,Bengaluru,Karnataka,Robo Embed,B.Tech
391,Financial Analyst Intern (Private Equity),"Assist in due diligence and market research for private equity investments","['Financial Analysis', 'Excel']","['Valuation', 'Financial Modeling']",Finance,Mumbai,Maharashtra,Private Equity,MBA
392,Media Intern (Digital Marketing),"Manage and optimize social media ad campaigns","['Social Media Marketing', 'Digital Ads']","['Google Ads', 'Analytics']",Marketing,Delhi,Delhi,Digital Adverts,BBA
393,Backend Developer Intern (Node.js),"Develop and maintain REST APIs with Node.js and Express.js","['Node.js', 'Express.js']","['MongoDB', 'Docker']",IT,Pune,Maharashtra,API Craft,B.Tech
394,Legal Intern (Intellectual Property),"Conduct research on patents and trademarks and assist in legal filings","['Intellectual Property', 'Research']","['Drafting', 'Patent Law']",Legal,Hyderabad,Telangana,IP Legal,LLB
395,Operations Intern (Retail),"Assist in store operations, including inventory and sales analysis","['Retail Operations', 'Excel']","['Customer Service', 'Communication']",Management,Lucknow,Uttar Pradesh,Urban Retail,BBA
396,HR Intern (Recruitment),"Source candidates, screen resumes, and schedule interviews","['Recruitment', 'Communication']","['ATS', 'LinkedIn']",HR,Remote,,Recruiters Hub,BBA
397,Frontend Intern (React),"Build and maintain user interfaces with React and Redux","['React', 'JavaScript', 'HTML', 'CSS']","['Redux', 'API Integration']",IT,Hyderabad,Telangana,React Devs,B.Tech
398,Civil Engineering Intern,"Assist in site surveying and project documentation","['AutoCAD', 'Civil Engineering Basics']","['MS Project', 'Surveying']",Engineering,Bhubaneswar,Odisha,Build Solutions,B.Tech
399,Data Analyst Intern (BI),"Build interactive dashboards and reports using Tableau and Power BI","['Tableau', 'Power BI', 'SQL']","['Excel', 'Data Analysis']",Analytics,Bengaluru,Karnataka,BI Solutions,BBA
400,Robotics Intern (AI),"Develop and test AI models for robotic perception and control","['Python', 'Machine Learning']","['ROS', 'Computer Vision']",Engineering,Chennai,Tamil Nadu,AI Robotics,M.Tech